{
  "schema_version": 1,
  "kind": "asset_package",
  "assets": [
    {
      "id": "939156d8-2928-54fd-9ff2-1da144ff893f",
      "asset_id": "77628419-f575-51a5-9ff9-e7d5b0e74794",
      "version": 1,
      "asset_type": "if_template",
      "asset_key": "if-excel",
      "title": "I/F 엑셀 템플릿",
      "payload": {
        "sheets": [
          {
            "name": "인터페이스 리스트",
            "columns": [
              "I/F ID",
              "I/F 명",
              "송신 시스템",
              "수신 시스템",
              "연동 방식",
              "주기",
              "데이터 항목",
              "건수(일)",
              "담당자",
              "상태",
              "비고"
            ]
          },
          {
            "name": "시스템 연동정보",
            "columns": [
              "시스템 명",
              "약칭",
              "유형",
              "담당 부서",
              "운영 형태",
              "DB 종류",
              "접속 정보(마스킹)",
              "비고"
            ]
          }
        ]
      },
      "status": "published",
      "change_note": "초기 자산",
      "created_at": "2026-09-30T00:00:00+00:00",
      "updated_at": "2026-09-30T00:00:00+00:00",
      "created_by": null
    }
  ],
  "related": []
}
